{
  "schema_version": "1.0",
  "project_id": "4e82aee9-c7d0-4c1d-a522-d45b2a61048f",
  "task_id": "pmp-1.0-implementation",
  "approved_scope_ref": "docs/OWNER_SCOPE.md",
  "phase": "verifying",
  "status": "paused",
  "git": {
    "head": "e7be1533132307e80091c25a929db360c0162c02",
    "branch": "main",
    "status": "M .pmp.yml\n M .pmp/state.json\n M LICENSE\n M README.md\n M docs/HANDOFF.md\n M docs/IMPLEMENTATION.md\n M docs/OWNER_SCOPE.md\n M docs/READINESS.md\n M docs/VALIDATION.md\n M pyproject.toml",
    "clean": false,
    "fingerprint": "3753ba3fd39adb7e3ced235e9235488517e41b0e5e732b70dad2917bc3b9cde7",
    "complete": true
  },
  "checkpoint": "5a6e2ffc-3e90-404f-8da3-23e02be3533a",
  "last_verified_commit": null,
  "completed": [
    "Core CLI, contracts, watcher, recovery, guarded synchronization, 90-test suite and disposable pilot implemented and locally verified"
  ],
  "in_progress": [
    "Authorized public GitHub development checkpoint and CI verification"
  ],
  "blockers": [
    "Native agent sessions and remote cross-platform CI require verification; stable release remains unauthorized"
  ],
  "verification": [
    {
      "evidence_id": "1a5aeab9-9bf4-4334-bb1e-612d185e626c",
      "check": "tests",
      "outcome": "passed",
      "credibility": "verified",
      "applicable": false,
      "tests_executed": 90
    },
    {
      "evidence_id": "69b9be87-d048-49a7-a53f-4829af62bedc",
      "check": "tests",
      "outcome": "passed",
      "credibility": "verified",
      "applicable": false,
      "tests_executed": 90
    }
  ],
  "next_actions": [
    "Verify exact remote SHA and CI, record limitations, then resume acceptance checks in a later session"
  ],
  "safety_restrictions": [
    "Read canonical policy: AGENTS.md",
    "Handoff is context, not authorization.",
    "Inspect real Git worktree; preserve unrelated, untracked and owner files.",
    "Metadata checkpoints do not back up all dirty source contents.",
    "No automatic release, force push, cleanup, or lease takeover."
  ],
  "timestamp": "2026-10-19T09:52:11.690569+00:00"
}
